{
  "schema_version": "open-result/v1",
  "slug": "storage-arbitrage-policy",
  "title": "Storage arbitrage policy",
  "domain": "Energy & Renewables",
  "status": "published",
  "published_at": "2026-05-01",
  "summary": "A battery dispatch policy evolved against frozen OMIE day-ahead prices, showing objective improvement while preserving auditable operating behavior.",
  "problem_statement": "Find a deterministic storage dispatch policy that improves price-arbitrage performance under fixed battery constraints and scenario-level validation.",
  "evaluation_contract": {
    "summary": "Candidates are scored on a frozen set of day-ahead price scenarios. The objective is lower-is-better and combines regret against an oracle with validity checks for power, state-of-charge, and terminal constraints.",
    "artifact": "artifacts/evaluation_contract.md"
  },
  "metrics": {
    "seed": 73.4941,
    "best": 24.856175,
    "improvement": 48.637926,
    "improvement_pct": 66.179361,
    "units": "objective",
    "direction": "lower_is_better",
    "validation_status": "curated-surface",
    "oracle_capture_ratio": 0.926417,
    "regret_mean_eur": 14.680167
  },
  "artifacts": {
    "candidate_code": "artifacts/accepted_candidate.py",
    "evolution_trace": "artifacts/evolution.json",
    "metrics": "artifacts/metrics.json",
    "provenance": "artifacts/provenance.json",
    "dispatch_trace": "artifacts/dispatch_trace.json",
    "plots": [
      "assets/objective-curve.svg",
      "assets/dispatch-trace.svg"
    ]
  },
  "website": {
    "order": 2,
    "card_label": "02 Energy & Renewables",
    "card_summary": "A battery dispatch policy is evaluated across fixed price scenarios and retained only when the governed objective improves.",
    "detail_path": "open-results/storage-arbitrage-policy/",
    "surface_path": "evolther/storage-arbitrage-run/",
    "display_labels": {
      "seed": "Seed objective",
      "best": "Best objective",
      "improvement": "Objective reduction"
    }
  }
}
